Comments,Classes
123A commodity we trade is beet pulp so I asked a coworker when working with it does she drop some funky beats Her response what are you on,NB
,NB
A never opens all the way until he she is completely sure you are trustworthy,NB
A porn star who thinks she is better than an escort if you think men control escorts you are SO wrong,NB
about and how sweet she is to every single person she meets You are the most genuinely car,NB
about and how sweet she is to every single person she meets You are the most genuinely caring person I know,NB
Absolutley nothing shehadnt said to his face So no is just trying to stir up shit How blind are you,NB
Achi you are right Being mean will fit Kelly not her She is sitting in the studio wearing some blue long sleeves Boring,NB
Actually she is And so are you,NB
actually you just hate her on austin and ally it doesnt look good because ally laura are so similar but she is actually,NB
After shes asleep tell her how amazing she is and how lucky you are to have her it takes less than 10 minutes to do but she wont forget it,NB
Alisha is known for making hate pages on lots of people Actually she did tell me last night so you are wrong,NB
All I can hear is mother talking to the dog going are you a dog or a chicken Shes definitely laying with her back legs right out then,NB
All she offers is no Yeah because your ideas are faulty you idiot,NB
all things are is possible when you believe in yourself she believed she could so she did,NB
all you guys are niggers who she think she is b,NB
Allysa and I are having a whole conversation about and how sweet and happy she is aw you guys,NB
alright King whats that some type of divine stratification Are you trying to imply she is not worthy Love the First Lady,NB
Amanda is building me a house when she gets back are you guys jealous,NB
an awfulmess WHY ARE YOU GUYS SO SHOCKED THAT TAYLOR SAID BITCH SHE IS 25 SHE CAN SAY WHATEVER SHE WANTS,NB
an iconic song like that Are you kidding You have to be Im not a HUGE Cher fan but Jesus I know who she is,NB
and bitch you put maryami before me are you fuckin dumb you slow frfr i always come before i made her who she is,NB
and thankfull of yourself too she may help but you are the one that was a warrior and still is,NB
And who are you to say who the wrong man is for a woman though If she chose him over you that s,NB
And who are you to say who the wrong man is for a woman though If she chose him over you thats who she wanted,NB
and who ever you are trying to egg her on your just about as goofy as she is,NB
Anna is mine and she has been mine for 8 years so everyone please take a step back so you are lesbian,NB
Are her teeth good When she sinks them into me I ll let you know Wolf Hall is smart good TV Mark Rylance is awesome,NB
are worth every second of your time so give them a chance whenever you meet them,NB
Are you able to ask the wifey for advice on 7,NB
Are you an artist looking for website features Only 5,NB
are you and bryana dating or is she just a friend,NB
Are you and still at Sundance My 16 year old sister is dying to meet him Shes his biggest fan,NB
Are you aware that Veronica Coffin is Tom s right hand piggy she sure is and becareful with that beotch fo sho,NB
Are you convinced that Brooke is happy for Or do you think shell eventually try to win Bill back,NB
are you dillusioned has Hopkins got into or silly brain she is sticking up for herself which will come out after,NB
Are you drinking She is winning what Not sure I understand do you think she wil,NB
Are you drinking She is winning what Not sure I understand do you think she will walk out,NB
Are you dumb Or is she a lesbian,NB
are you dumb this is Abdul she needs to send in her CV,NB
Are you excited for the Grammy Awards on 2 8 15 We hope Taylor Swift will win the 3 awards she is nominated for,NB
Are you excited for the Grammy Awards on 2 8 15 We hope Taylor Swift will win the 3 awards she is nominated for ht,NB
Are you feeling Flirty today DM me and I ll tweet her how she is lt,NB
Are you feeling Red Hot for Valentine s Day You can bet she is,NB
Are you fucking kidding me She tweeted seven times SEVEN FUCKING TIMES NO MORE AND NEITHER IS A FAN REALLY,NB
Are you fucking kidding me tmz Katy Perrys only asset is her boobs Let s discuss how much cleavage she should have at the Super Bowl,NB
are you going to do another series of sil witness have spoke to Emilia she would like to this one is great,NB
are you guys going to shoot soon She is amazing,NB
are you hitting me She looks like a nun If anything she is dressed too conservatively,NB
are you in love with angelica because it seems like she is in love with you are you cupid,NB
are you joking Is it because Shes black Lol,NB
Are you just saying that because she is within punching distance,NB
are you kidding me It is the woman who should be kept off the plane What else has she done and to what,NB
Are you kidding me she is rehearsing 24 hours,NB
are you kidding me So what Shes doing is okay Get shit straight Colton this girl is a bitch to everyone for no reason,NB
are you kidding me this girl is the most ignoramus person I ever seen Shes an idiot and somebody needs to put her in her place,NB
Are you looking for a little girl How about Nala is still waiting for her forever home She has a great boxer,NB
Are you looking to buy a new car Contact very affordable cars Honda Accord,NB
are you made apologise to that girl she is her worst enemy she throw a drink on you,NB
are you meetin camila when she is 17 or 18 18,NB
are you not bullying here right now Keep in mind she is only 14 or so Be careful that you are being Christian,NB
Are you on your period when he next level stupid he thinks just because a girl is angry she has to be on her period,NB
Are you planning to travel soon Call Elite Travel Adventures She is local and AMAZING,NB
are you really a lovatic yes She is a warrior just like Demi We Are A STRONG Family,NB
are you really a lovatic yes She is one of us She is a warrior jus like Demi,NB
Are you really because this is what you get if she wins,NB
Are you really going to continue teasing me Runs her fingers in between her folds to see how wet she is Come on,NB
are you really tall or is she really short,NB
are you saying that she is injured,NB
are you scared of anything who is anything Is she he scary,NB
are you serious How is she an amazing mother,NB
are you serious Should she be stuck up Katie h s arse instead then and listening to her vile bullying KH is just using the others,NB
are you single Are your friends Telus is hot but she seems kind of needy And Rogers is too yknow awful,NB
Are you sitting down Ok Ready for this is officially on the island For good She s,NB
are you stupid She said it to me in a dm What she is saying to you now isnt true Maybe she forgot or maybe you forgot,NB
Are you sure Because she is abusing them Filthy,NB
are you sure hows that other mijita is she ok,NB
Are you sure I just received an email from Carly Haycock she said it has to be a US card as there is no other country,NB
are you sure Or is she going to get mad,NB
are you sure she is coming,NB
are you sure she is only 18,NB
Are you sure thats not your boss Looks more like he or she is checking up on your web browsing Whacha doin there Deb,NB
Are you sure this is what the humans wear she asked milky white eyes shimmering in the dim light She took the blanket,NB
are you talking to because yes she is,NB
are you telling me she is able to tame a demi God Come on Wasp that will explode into her servos,NB
Are You That Somebody is just not as good by anyone other than Aaliyah May she rest in peace,NB
Are you that who is always on her when she should be attending to,NB
are you two having a guest host tomorrow and or Friday If so can you reveal who she is,NB
are you watching bb there all going Krazy cause Perez is back lol watch Katie h face she looks like a man,NB
are you watching it This girl makes me want to shoot myself she is so dumb,NB
as she told me islam is perfect its you guys who are imperfect dont want 2 go thro these once more,NB
As soon as you are done drawing her she is,NB
ASHTON GO TO PROM WITH THIS GIRL SHE IS MADE OF SUNSHINE AND SO ARE YOU AND I WILL DRAG you TO PROM IF I NEED TO,NB
at least you know she is perfect But you are up there too You guys are In the Berdine family,NB
Attention again Kmashoppers doors are closing and if youre the one who brought the horse she is now my wife,NB
awh Mummy Harrop how is she Are you able to come to see it at all,NB
aww girl Im sure she is so proud of every accomplishment you are making and will be right there with you on Saturday,NB
aww she is so gorgeous You are the one on the left right so pretty,NB
Aww thats sweet D are you taking her name or is she taking yours We are double barreling it,NB
baby what are you doing here come back to the party leave me alone dont get mad with me she is an old friend,NB
Bbc are still saying Ross Kemp is on do you share the same maNBer and he she has buggered it up,NB
bc i gave her a chance and saw what an amazing person she really is but you are too blind to see that because of,NB
Because not all people who suffer are visible and she is the best mommy in the world love you,NB
because she is cute and you are not,NB
Before you had been promised Before she is a liar Before you are dismantled fixed and broke again,NB
BIG NEWS OUT OF HOUSTON Rasha Alkhatib is a PEAK Achievement winner Shes going to Hawaii Congrats Rasha We are so pr,NB
Big shoutout to because she is freaking amazing If you are not following go follow,NB
Billie holiday is an example of your past and your circumstances are not who you are No matter what obstacles she faced,NB
BOO YOU ARE TRENDING Justice Is The New Black omfg congratulation SHE DESERVE IT,NB
BooBear please follow She is sick Her eye is sick You are wonderful,NB
BRUH ARE YOU KIDDING ME IS SHE FOR REAL,NB
Bull She is an embarrassment and you are a real IDIOT,NB
But She Said She cant Pretend na LOOOL Telling twitter you are horny Where is your dignity as a lady,NB
But what if she is Sen Cornyn asks Ms Lynch You are not Eric Holder are you She says no,NB
But yeah if youre straight and you ain t going down then what are you even doing and how is she even stick,NB
But yeah if youre straight and you ain t going down then what are you even doing and how is she even sticking around,NB
But your fiance is Klaus Are you afraid of giving your body to him I cannot believe what she is saying so I shake gt gt,NB
by definition it is not an interview If this woman is as great as you people are making it seem she should know that,NB
can play zombies with you It would make my day My mom has the FLU and she is Prego So things are going bad,NB
Can t believe my mom s little girl is as pretty as she is are you the little girl cause I can,NB
Can you believe Shes dating Zedd now Like one who the fuck are you and two he is fucking ugly,NB
can you please add photos and tell us about how she is doing There is nothing here people are starting to wonder ask if its scam,NB
Can you please RT Mitsy is 10 yr old She went missing in Rutherglen Glasgow earlier today Family are distraught http,NB
can you tell us what is happening with Batgirl she seems to be sold out are you releasing more,NB
Cassie s mom calls her and the FIRST thing she says to cass is are you sober,NB
Cause I couldn t have just made up a class that she showed me in s then tell me who you are if this Is so true,NB
Chantelle is to sholive life like you are taller than her and love her even tho Shes a shoass,NB
Charlene is not getting it that me and John are just friends and Shes like Beth you should get with him and everything,NB
Christian Rap Towards Me Her nails are pink her hair is curly shell she ll give you luv and then a swirly,NB
Christina is the one in your group you are scared to take in public cause she has no filter,NB
Christy is a little ish starter now she wants to play victim stop you are not going to win an Oscar,NB
Congratulations to Ms Russandra who had a beautiful baby girl today We are so happy for you Thomas and Kyla She is beautiful,NB
continued M tley she even thinks so she is friends with you on FB I tried requesting you but couldn t you are full,NB
Cop are you on probation got any warrants Anything like that Dad lol no Cop I can tell your daughter is because Shes just sitting there,NB
Cornyn is an idiot Sen asks Ms Loretta You are not Eric are you She says no,NB
cOULD YOU POSSIBLY GIVE A Shout-Out TO MY DAUGHTER JALIYA SHE HAS THE FLU AND HER B DAY IS TOMORROW YOU ARE HER FAV YOUTUBER,NB
Crispy shortbread are you having a laugh Is she having a laugh,NB
Dad who are you sending a package to Me girl named jasmine Dad is she in jail Yes father Jasmine is in jail,NB
Demi is such a strong woman I am so proud of what she has done so far I love you warrior YOU Are THE best,NB
did you finish the episode already Is she being treated Are they talking,NB
did you hear they are making her pay for her own electronic monitoring since she is on house arrest,NB
Did you know There are only 2000 days between the time a baby is born and when he she will begin kindergarten,NB
Disneyland Winter Drake studies a map of the theme park YOU ARE HERE the sign reads Yeah Drake mutters But,NB
do me you dont know she is Israeli wnt a divorce i shant wait we are already there neh,NB
do you know A British critic writer she is a TW and her fictional love stories are incisive amazing,NB
Do you know She is a transplant British Iggle too You guys are so lucky,NB
do you really think she enjoys knowing they are miserable Shes doing what she is paid to do,NB
Don t know what My original statement which you are questioning IS a question I didnt say she IS I said IS SHE,NB
Don t trust any girl that constantly says you and your boyfriend are so cute together because Shes really saying your boyfriend,NB
Don t trust any girl that constantly says you and your boyfriend are so cute together because Shes rly saying your boyfriend is so cute,NB
don t worry about it Is she OK Are YOU OK Take all the time you need love wish her well,NB
Drea s niece is so cute she kept staring at me probably thinking who are you and why are you sitting next to me,NB
dude What did she say omfg You are so lucky I am jealous what is your life,NB
Dustin Paxton are you freakin kidding me they should both spend time in solitary she is as messed up bad decision,NB
EVEN IF YOU ARE DATING YOU BEST FUCKING ASK THAT BITCH TO BE YOUR VALENTINE DONT ASSUME SHE IS BECAUSE DATING NO ASK HER BE A GENTLEMAN,NB
Every girl wants a guy who she can run up to with her hair a mess no makeup and the first thing he says is You are beautiful,NB
Every girl wants a guy who she can run up to with her hair a mess no makeup and the first thing he says is You are beauty,NB
Every man should be as Blessed to know You are because She is,NB
every single day one of my mutuals is like why does she block me ive never talked to her in my life why are you so childish,NB
Every Word She said is so Damn True Hats off Gal You nailed it,NB
everyday there is a question I am asked to e mail to you Like mommy why is she so kind So do tell why are you so kind,NB
Everyone go follow Lauren s mom lol she is probably hotter than you are,NB
everytime I go to the dentist she compliments my hair and teeth youre hair is so beautiful and 30 minutes later so are your teeth,NB
EXACTLY Feels like you I are the only two who seem to remember that she is vile,NB
Fam if she ask you What are we The correct answer to her question is 75 water,NB
Fanks pal she is a lot better hope you are ok,NB
Felicity s story arc is trying to figure out which guy she should be with thats it Are y,NB
Females are never wrong Ask a chick whats 1 1 the answer is what ever she say it is Damnnnn rightttt,NB
First thing my mom says to me when she gets home is are you high Haha yeah mom totally,NB
for Brandi to come between two sisters is despicable She is pure trash you are so much classier than her,NB
For Jennifer Rubin once Shes joined your crew you are the ship and all else is the sea,NB
For those of you who are new or do not know our Ashley She is our office maNBer and had premature twins just a,NB
Friends are you still watching Sherri twerk Me it is officially my life and she is so on fleek when she does it,NB
Girl in front on the phone first thing she says is Are you asleep well obviously NOT if there on the phone talking t,NB
Girl in front on the phone first thing she says is Are you asleep well obviously NOT if there on the phone talking to you,NB
girl you are better person than her That was a fucked up bogus comment she said to you Wth is wrong with people Awful,NB
glad she is eating well hope the cough and conjunctivitis clears soon When are you moving,NB
Glad to hear you are reunited with your bag Thank you for your shout out for Julie She is an assest JP,NB
good luck on having the new baby I had my first at 41 and she is now 12 and me and my husband love girl so I know you are good,NB
Good read and I am guessing he or she is an asshole Fast if you have to,NB
GOP controlled Senate will actually confirm C mon you are in charge now She is a great lying liar,NB
gosh you dont know anyone she doesnt need to know people people know her true this is what dreams are made of,NB
got it Thank you She is so stupid I know I have said that 20x or more but the lies are insane,NB
Grace is a slut because she ate Cheetos who were sluts if you eat a slut you are one,NB
haha and she know ma math is your forte soooooo You are SOL man I still gotta take this quiz,NB
Haha I texted my sister about the fire and she was like omg are you ok And my mother s pretty chill with with her is it a fire exercise,NB
haha She is purty As are you lovely lady,NB
Haha she is your mom so you kind got to respect her But I understand where you are coming from,NB
haha that would be fucked up atleast she is indirectly telling you my parents are fuck niggas sometimes and just say I look bad,NB
hahaha that she is What are you sick with,NB
hahaha you are killing me She is like I have PMS Im so young,NB
hahahah are you serious that how one of my dog is she takes over the whole bed Im like really Lol,NB
hahahaha oh my god she still does that now the sun is out and so are you,NB
Hailey found out if she is a See if you are at and every Friday on,NB
Hailey is throwing shade you need to get her out of ur life because Shes not treating you like the princess you are Im here for you,NB
Happy Birthday to someone who inspires me in everything she does Hope your year is as wonderful as you are,NB
Harper you really are a dream She is wearing our Beau in red and Baby Belle tutu in Red Velvet,NB
has got to go All Shes doing is talking shit getting involved where she doesnt belong Who are you A forced s,NB
has got to go All Shes doing is talking shit getting involved where she doesnt belong Who are you A forced storyline,NB
He asked me help through another friend She is one year four months old DM me if you are willing to help,NB
He is ruder than she but you are the rudest of them all This is the finest piece of work I ever seen In the bowl was a deep blue pow,NB
He Loves Beer She Loves Wine event is almost sold out 4 seats left If you are interested in,NB
Helga starts driving for Uber only customer she gets is Brainy H Why are you requesting me to drive you B Uhh I dunno,NB
Hello Tony How are you My daughter needs prayer again She is back down It has been 3 days This is very scary but God,NB
Help me the to do my friend smile,NB
her Her relationship with her supporters is honestly just so beautiful she treats us as if we are her best friends You,NB
her Her relationship with her supporters is honestly just so beautiful she treats us as if we are her best friends You can tell she,NB
her life is a mosaic of heaven hell you want to experience both you are the artist she is your muse,NB
her Shes so surprised Shes frozen Are there different types of kisses Do you kiss friends Is she supposed to say no,NB
Her to a psychiatrist because Shes messed up Like are you kidding me She Is NOT Depressed And my sister has a friend here tonight and she,NB
hey how are you doing can take you out of depression if you are actually depressed She is you,NB
hey how are you doing can take you out of depression if you are actually depressed She is your key to happiness,NB
hey is at Union Square She really wants to meet you WHERE ARE YOU,NB
hey Lewis how are you and how is Lauren is she feeling better,NB
hey swifties help out another swiftie and follow she is super nice you are going to love her,NB
HHAHAH she probs stalking your Twitter THIS IS WHY YOU GET TWITTER THE INDIRECT MOMENTS ARE,NB
Hi guys A friend of mine tried to follow you are but its showing she is blocked She has never followed you before Help,NB
Hi Harry Hope you are fine I love you so much Can you follow she is so amazing Pleaseee PLEASE,NB
Hi Helen Alanah Allen is very sad that she does not see you on Facebook any more to talk about football etc Are you OK,NB
Hi How are you Koharu is my best friend She always talked only about you and love you,NB
hi I am bringing April who was in panto with you to your show She is so excited We are sitting near the front,NB
Hi I hope you are having nice day well you should follow your biggest fan she is just saying,NB
Hi She loves you so much You are her world Can you follow This is her dream Please,NB
His girl-friendyeh you are I must be blind She is prettier thn every singl lady on twitter,NB
Hm Oh my name is Rachael Rachael Brown And who are you She turned around giving him an innocent smile,NB
how are you able to keep ur composure when dealing with NatG how disgusting she is,NB
How are you going to say I dont feed my child thats why Shes so small Um no my daughter is a pig lol Shes been tiny since she was born,NB
How are you going to tell a girl that she is ugly and try to tear her down If you are that low then you clearly need to get some help,NB
How are you Help me the to do my friend smile She is very special Thank you,NB
how are you so good this my wife is bored by the various youtubers I watch but I always know she will enjoy every video you do,NB
how are you treating your daughters lyme is she progressing or healed,NB
How do you even get camila to tweet you Or tell you that she loves you or that she thinks your hugs are nice or your,NB
How do you even get camila to tweet you Or tell you that she loves you or that she thinks your hugs are nice or your face is nice,NB
How is Ray her date when last week she basically said I care about you like a friend because thats exactly what you are,NB
How often have you heard the comment He or she is a There are certain found in are you,NB
how old are you and Jordan I 15 and jordan is 15 but sometimes Shes older than me for a few months its great,NB
How old is she and how old are you ambo,NB
How sad is she Danielle Smith are blocked from following and viewing Tweets Learn more,NB
How tall are you If a girl is my height or taller she paying for the dates foh,NB
I always talk to her about the girls I told her about how Im seeing them again and she was like why are you excited this is the 4th time,NB
I am glad that you burn that friend contract with Nene She is jealous of you because you are pretty and she is ugly,NB
i bet emiliaclark or whatever her url is has a shrine about you she probably worships your ass everyday before she sleeps you are her,NB
I can hear Leigh She is Jesy as fuck JESS YOU ARE AMAZING Little Mix Vines https t co XERU9z8cUX,NB
I cant cope with you how creepy is she Then glasses are something else,NB
I cracked it I KNOW NASH YOU ARE WORSE THAN MY COUSIN AND SHE IS 5 HAHAHA,NB
I dont even know with my mom one minute Shes like this is still a shock and the next day Shes all by the way when are you changing your name,NB
I hate messy females why are you worried about what another female is doing or how Shes doing it Mind your own business Sheesh,NB
I have a size 4 from prom last year its a little poofy and bright but just DM me if you she is are interested,NB
I have just as many scholars who say that she was 14 20 yrs old The fact is that you are still defending marriage to minors,NB
I hope she is okay I know you guys are close,NB
i hope that persons right and she is hurting herself Are you trying to say Im no good for her in a nice w,NB
I hope you stay She is pretty doped up and resting comfortably We are waiting for results of blood draws improvement or no,NB
I just asked my 1yr old niece why are you so weird she said so clear I dont know What the fuck this little girl is amazing,NB
I keep calling her she but she is me Im the one doing this Charlie thats not who you are its a twisted version of Me,NB
I keep laughing at everything my mom is doing and saying and she says are you okay Are you high You smoking the pipe or something,NB
I know dear that you are friends with Pam Anderson She in turn is close to a dear Mexican friend of mine an alover like you,NB
I know she is still whining about it but so are plently of other people If you were in her shoes you wouldnt want hate,NB
I know she is which is why I think you are going to get the smash ball 50 times,NB
I know she misses you too Im so sorry you are so sick honey let me know if there is anything I can do,NB
I know that is why it got me off guard I was thinking are you two fighting You never know She could know of you,NB
I know what cartoon character you are You are sloppy Squirrel omg she is right,NB
i know you through a mutual I dont know what the fuck she is but you never did me anything that forehead pokin but you are still beautiful,NB
