Comments,Classes
slut puppy cunt whore dog bitch,B
So are you coming to can tell you how much fun it is too bad she has t,NB
So are you coming to can tell you how much fun it is too bad she has to work,NB
so are you saying that my mom is your exercise then saying she has herpes Round of applause for that one,NB
so beautiful and glad you are having adventure Take care you are precious to many YES She is Have FUN,NB
So essentially Lynch indicating she would not uphold the laws of the land is acceptable Either youre legal or you are not,NB
So excited that because of YOU is seeing my Lupus Dr today And she and are all at taping tonight,NB
So if you ask a bitch whats 9 10 and she says 21 is she right rule in life women are always ri,NB
So in love with commanders She is such a beauty Out of every window there are beautiful views that gives you that uptown vibe,NB
SO mother TELLS ME SHE IS GETTING A DOG WHEN I TELL HER I MIGHT BE LEAVING ARE YOU KIDDING ME,NB
So my coworker was like today how my body shape is so cute and I was like I guess I wish I had a booty She was like you do what are u,NB
So she knows my real mental health status She is who everyone goes to for counseling She said Are you sure you need this,NB
So sorry about your mom You are one tough guy for being on air I would choke up too much Im sure she is proud,NB
so this is the first time Ive heard my neighbour the other neighbour and Shes listening to Bruno Mars Just The Way You Are respect,NB
so umi is like mumbling in call i literally said umi are you a poop yes or no she said yes what even,NB
So you are telling me you haven t follow yet MAN WHAT ARE YOU WAITING FOR SHE DOES GAIN TWEETS EVERYDAY GUYS,NB
Some of you tweet rubbish just to get womans attention treat her right Tell her how beautiful she is when you are,NB
Some of you tweet rubbish just to get womans attention treat her right Tell her how beautiful she is when you are dogs,NB
Someone said you are not fit to sleep with pigs I stuck up for you and said oh yes she is,NB
Someone who cares for you loves you and is constantly wondering how you are just wants to hear your voice before she sleeps Screw you la,NB
SOMETHING JAPANESE The Japanese are known for their advance robotics but have you met Aiko Chihiro She is a,NB
Sorry I did it without purpose I was just saying what i though Maybe she is better in school Maybe you are better at life,NB
stfu pussy your host is shit why are you even hosting you loser way to make us lose because your skippy host is shit pussy,B
Still talking shit after I beat that ass sore loser,B
stop being so fucking gay you pussy,B
Student voice and perspective are important shadow a student to see what you learn,NB
stupid money whore cunts DIE,B
Suck a dick suck a dick suck a dick suck a motherfucking dick suck a dick suck a dick suck a big fat dick,B
suck a fat dick assholes go die bitch,B
suck a fat one,B
suck a fat one mate,B
suck a fat one you anorexic stalker Get the fuck out,B
Suck it loser PrussiaBot,B
suck it nerd,B
Suck it WHORE haha,B
suck my dickkk gay bitch,B
suck my fat cock,B
suck your fucking mum you fat cunt,B
SUCK YOUR NANS DRY CUNT YOU FAT GINGER VIRGIN PEDOS,B
suck your nans fat 20 inch veiny hairy pulsating penis,B
suck your nans fat 20 inch veiny hairy pulsating penis HAHA,B
suk your dead nanny and grandad you fat cunt you had 12 fuking men,B
Sunday Josh What are you wearing Me Leave me alone dude Josh You look Rockabilly Tory Leave her alone she is a rockabilly,NB
Super cute I know you are doing your thing Indeed she is,NB
SWAY your VIDEOS SUCK SO MUCH SCARCE FANBOY your FUCKING UGLY AND your MOM SHOULD DIE,B
TALIA WHY ARE YOU EVEN TRYING she is NOT available bye,NB
talk shit about my best friend ever again you fat cunt I ll set your mothers legs on fire then get 5 gyp,B
Tarajis eyebrows are out of control It looks like Shes constantly asking What did you say Is that a character thing,NB
Teacher Why are you putting Adele pictures on the globe Me Because she is my world,NB
Tell Sarah happy birthday for me please she is cool and you are too I want to be like you,NB
tension too Lynda this is Amber Shes my wife Lynda s eyes fold into a laugh Oh Roman you are really something,NB
texting to this girl yeah havent talked to her proper in a while and am like you are up late today and she is all am i am like yeah,NB
that Lis a damn shame You sicko fuckwads with no self control are just proving her point about you And Shes right smh,NB
That moment when the dildo shaped turd lodged in your asshole prairie dogs inside you Your throbbing fat pussy quiv,B
That moment you are sitting in a bar and a girl from is across from you mutually online and she dismisses your profile,NB
that picture is so pro she looks unreal lt 3 Are you a little bit better,NB
that s actually true you fat cunt fucking bring,B
That s how a sluts pussy should be whipped That s how a sluts pussy should be whipped,B
that will  never happen She said Julia are you hiding Is your phone out,NB
That you are a Prime She smiled It is such a honor to be in the presence of a prime,NB
thats a fat pussy,B
thats all i ever want you to be is happy and if the rumors are true i hope she treats you well but you havent said anything,NB
thats horrible Is she ok Are you guys ok You definitely win the worst wednesday prize,NB
thats one fat pussy,B
the best pais when she said if youre under 14 you dont understand and are experiencing emotions,NB
The enamalware pots are one set Everything else is another set HOWEVER she said to contact her if you told me you only gt,NB
The funniest pais when a woman says she is her mans responsibility no babe You are your parents responsibility,NB
the kind where you are intimidated because she is my favorite person on twitter,NB
the kind where you are intimidated because she is my favorite person on twitter Highly Agree XoXo,NB
The lady who helped me meet R5 is the true MVP because she didnt know who they were said I think the guys youre looking for,NB
The less interested you are the more interested she is,NB
The LORD said there is someone here you are worried sick but the LORD asked me to tell you I AM still on My Thr,NB
The main thing with Laura is that she is literally the nicest least judgemental person and therefore as long you are a nice person she,NB
The music is really pretty Some of it And the graphics are awesome dont you dare laugh She rolls her eyes sitting,NB
The only reason you are alive is because we need you help to kill her and she is an even worse pile of crap than you are,B
The person you are phone calling is not thinking about the mess he she did please lend your tears when you hear the beep,NB
The person you are phone calling is not thinking about the mess he she did please lend your tears when you hear the beep beep,NB
the pussy should ve came with a guest list,B
The saddest thing when youre dog is more outta shape than you are lol she cant hang and Shes only 4 months,NB
The shoone I think she is in Medunsa I want to know which One you are talking about,NB
The thing about her dress is that she dresses trashy like a hick thinking they are fashionable Oh Bumpit you are clueless,NB
the way she describes you is so much different than you really are,NB
The whiter the whore the harder a black master will pound her cunt,B
the worry that is feeling me and tell me what you are hiding from me Dread filled her being as she waited for his,NB
Then I phoned my Grumma and she said is there something I can help you with or are you phoning for a chat How annoying are these people,NB
Then she going to go to sleep like it is 7 21 what are you doing,NB
Then you are exceptional in my eyes She is the future To let her experience the past she will learn where NOT to walk,NB
then you are just a clueless fool who has no clue what she is talking about,NB
There are 4 years old days to days that Demi is out of the center Now she is so happy thank you,NB
There are 7 of us who Tweet under this acct Just an FYI If you want Doc Shes but sometimes is online he,NB
There are 7 of us who Tweet under this acct Just an FYI If you want Doc Shes but sometimes is online here Thank you,NB
There are plenty of ugly women If you have the money you can be beautiful This is what she said Andressa Urach SHAME,NB
There are signs in the tube asking you not to vape in the station Is that really a verb As in I vape you vape he she vapes,NB
THERE ARE SO MANY SIGNS IN GG THAT LITERALLY TELL YOU WHO SHE IS AND NOBODY FIGURED IT OUT TILL THE END SO I FEEL SO DUMB,NB
there is a drunk girl in the bathroom at the bar yelling at the automatic toilets she just screamed ARE YOU FLUSHING ON ME,NB
THERE IS A HEADLESS HORSEMAN MURDER SHE WROTE EP WHAT ELSE ARE YOU PEOPLE HIDING FROM ME,NB
There is no good way to tell your female classmate that you are not well acquainted with that you think she smells nice,NB
There is no greater feeling than knowing you are giving a child the tools he she needs to b successful nlife,NB
There once was a cunt named Beau Who s eyes were so pink he looked like a freak show,B
There s a girl on say yes to the dress and she is 17 years old How are you financially stable,NB
There s NO WAY In Tha World Any Of You Bitches Should Be Broke Cause Yall Sittin On AT LEAST 60 Worth Of Pussy,B
therefore if you feel that her vagina has lost value then you are suggesting that SHE has lost value and that IS judging,NB
These niggers pussy they should wear skirts,B
These young whores kill me swearing up and down that they gay when in reality they just fuckin confused,B
they need oliver so bad they are shit without him laurel you aren t sara because she is bae and you are not,NB
They should all die All of them Everything annihilated,B
they should all die an horrible death,B
THIS cant BE REAL https t co yREGSdDINh are you kidding me Is she this stupid,NB
This girl is playing quizup and she seriously just asked the people around her what Ron from harry potter s last name is Are you serious,NB
this girl is saying she started out the SEMESTER with 8 twelve packs of coca cola in her dorm is down to a few cans HOW ARE YOU ALIVE,NB
This girl right here is a hero The things she does to educate and help are beyond measure,NB
This girl right here is a hero The things she does to educate and help are beyond measure Thank you Amanda,NB
This girl right here is amazing why are you guys giving her hate Shes seriously such a great artist and friend and actor ily,NB
This girl said she wanted to learn the language Brazilian What the fuck are you actually that dumb the stupidity is astonishing what the actual fuck,NB
This hentai whore has a cock and a pussy so she can fuck and get fucked at the same time,B
This is a little Screamy you are so kind it was plenty screamy If she reigned it in it would have been nice,NB
This is Instagram diamonds what are you talking about besides its not OUR fault she chooses here for the FAQ,NB
This is It and I am It and You are It and so is That and He is It and She is It and It is It and That is That,NB
this is my freak account I am somebody you know amp I have to tell you that Id love to nut in your pussy raw balls deep Repeatedly,B
This is my roommate Shes nice but kinda not I dont know Wow her boobs are so big you can tell she parties a lot,NB
this is not the reason as you are more than aware goes to disproving lies she is innocent naive girl big bad T Dogg corrupted,NB
This is where you I are different Because this is all I want to talk about Letterman to Paris when she didnt want to talk about jail,NB
This one is just too cute Love when she puts on costume You are just so adorable,NB
This social networks are getting smarter every day now you chat with someone and both twitter and Facebook let you know who he she is,NB
This tweet is for T As a teen she struggled with gender identity and depression Doing better now Embrace who you a,NB
This tweet is for T As a teen she struggled with gender identity and depression Doing better now Embrace who you are,NB
this was me I texted you this haha sucks to suck huh loser,B
Those who harp on the petty reveal they are out of argument You folks Is she a racist,NB
To be honest if Ashton and Bryana are dating whatever and if she is as bad as you all say lets just hope that Ashton will learn from his mistakes,NB
To my mind there are no ugly women The very fact that she is a woman is half the battle Oh but how could you understand that,NB
To the prick continuing to bother abigail she is awesome you probably are jealous of how awesome she thanks,NB
to this strong little cookie She is flawless and has beyond made me proud Brooke you are such,NB
Today a girl in my class was like Im Italian and my teacher was like sure you are like I think she knows what her background is,NB
today my art teacher told me Im better at drawing then she is if students are better then you then why are you teaching,NB
Today this girl almost hit me because she wants my boyfriend like surly heck no are you crazy he is mine mine mine mine,NB
told candice you cant find love at 19 and 20 her bf is 19 and she gives me this death glare smerks saying What are you talking about,NB
Told you that Sawalha was a wrongun from day one What an odious woman she is Which lunatic asylum are voting for her to stay in,NB
Truth is Im glad she ain t boring WAS RIGHT I dont want to  come home to whos home YOU ARE YOU ARE all happy and shit P,NB
turns so you are laying on your back and she is on top of you so her wings dont get hurt,NB
U don?t get no dick if its a bush down there girl I should see nutn but pussy when I look down there,B
Ummmm are you KIDDING me You guys is she not a superstar Put this girl on Broadway,NB
Understanding Women isnt a mystery When you are wrong Apologize When she is wrong still Apologize,NB
Unfortunately all the signs that a woman is in love with you are exactly the same as the signs that she wants to murd,NB
Unfortunately all the signs that a woman is in love with you are exactly the same as the signs that she wants to murder you,NB
Unfortunately she is back in the hospital today for a reason relating to her heart I am praying for you mom you are a fighter,NB
Ungrateful idiots should just die,B
Video seelywights Riley always checks to see if you are as happy to go on a walk as she is,NB
Wait Why hahah Are you being sarcastic Is she not nice,NB
Wally Where are you There she is,NB
want stick dick in a nigger ass amp then a bitch pussy go head with that gay shit my nigger,B
want them to go or me for that matter She teased Ah so that is another reason why you are eager for a tummy rub She,NB
wants us to put a cock in each of my holes at 1 time,B
Wcw is my bae Taylorrrrr Pace girls are hot Shes white and Asian so yeah lmfao love you ass fuck wipe,NB
We are doing our best and you can write to your MP if he or she is Labour,NB
We are sorry she is disappointed Please reach out to us at so we can better assist you Thanks,NB
we are working on things still You know this is going to be a long process She is going to be working with me so perhaps gt,NB
We dont speak for a while and first thing you ask is who is she Why not how are your grades smh,NB
WE FUCKING WAITED 1HR NOW 2HR ARE YOU FUCKING SEROUS YOU SUCK FAT CACTUS,B
We re LOVING that is Oh yes she is Are you,NB
we should fight him for being so gay,B
We Should Kill His Whole Family,B
we should of kept score to see how bad i actually beat you,B
well down Callum you are so right Nadia is a joke believing a psycho like Perez Shows how dumb She is more irritating than thrush,NB
well hello my name is Daniel she didnt say better She said higher So who the fuck are you,NB
well it seems that you are doing it now Remember Alex is just seeking reassurance she wont know what you are thinking,NB
Well kill you white pig I will fucking kill you you black bitch Wits student,B
Well my favorite pais when she be like Are you stoned and hes like They tried stoning my dear Pahahahahahahahahahahahahaha,NB
well she is excited to see you tomorrow she was telling me how you are such a great kid that she is pretty much in love with lol,NB
Well that s horrific this couple should kill themselves,B
well you are right she really is,NB
what a coward she is Unbelievable Praying for all of you that are hearing such a sad story play out,NB
what a fat cunt,B
what a gay cunt,B
What about jess are you over her Is she upset about Yes Im over her I haven t told her about it and she,NB
What are some theories of Beth coming back and if you know what episode is she coming back in I need it,NB
What are the chances of a bitch telling you she is a bitch,NB
what are you talking about salome is long dead and gone now all she is is a pastel princess,NB
What Are you thinking of Pricey in the house so far I think she is brill,NB
What does this meaN LAUREN TELL US IS your PUSSY GAY,B
what else would I want a fat ugly cunt like you for,B
What I mean is What are you doing here In this forest She explained a bit,NB
What if she intended to Lol thats not an interview Considering the way twitter is set up DM her if you are serious,NB
What is your problem what you wants to prove are you feeling jealous that why was she invited,NB
what makes a bride beautiful on her day is how she feels not what she wears So long as you are excited youll look gorgeous,NB
What she does is easy Alot of people are sman I beg to differ at you saying any smaperson can come up with what she does,NB
What She noticed his nose is bleeding Are you okay,NB
What Shes giving us is what we actually wanted for a long time yet you still want to  be the same person you are,NB
What the fuck is going onnnn lol she keeps attacking me and my dad is ignoring her lmao Great job dad You are such a hero,NB
what What are you watching She is horrendous You cant reason with the unreasonable,NB
What you think she killed because the Bishop didnt babtize her Is that what you are saying really,NB
Whatever the situation is know the solution is right at our finger tips New Vlog Post What Are You Running From,NB
whats wrong with slut shaming you should be ashamed to be a slut,B
When a woman says Shes bored it is not an invite to message her Unless you are the one who she wants to message her,NB
when i told my sister i had her she was like youre screwed haha i guess she is terrible and there are like no grades in the class,NB
when she asks what are we is this why you hate him,NB
when she asks what are we is what you shoulda said when you know who asked you,NB
When she is happy you are happy,NB
When she is mad dont explain why you are sorry in long boring paragraphs Just simply say Im sorry usually its better than a paragraph,NB
When she say she is horny when you are at work and you say youll bang it out,NB
when that one friend who thinks you and her are really good friends but really all she does is talk crap about you and acts like its ok,NB
when the water bottles are like 3 feet away but ur mom is like one feet away so you tell her to grab you it to prove that she loves you me,NB
when you are at home She is not mad or disappointed She only muses without reproach It is what it is or maybe not its tiresome to,NB
When you didnt know bae could sing https t co nVEbkJAP4y oh my she is so perfect Black babies are th,NB
when you find out who your real friends are ours is KV because she always brings treats,NB
when you say she are you referring to every woman in gaming who is harassed almost daily,NB
When you try to look for flaws BUT FAIL BECAUSE THERE ARE NONE thats HOW PERFECT SHE IS,NB
When your cat eats your mouse because that is what they are for and what she does is there to get you another speedy delivery,NB
when your friend is a living prophet she doesnt foresee your termination Both of you ar,NB
when your friend is a living prophet she doesnt foresee your termination Both of you are BUSTED,NB
When your roommate texts you and asks if you are alive you know she is a keeper,NB
where are is she staying when youre on tour,NB
where are you by the way And shell most definitely miss her coffee if she drinks it For Melbournians coff,NB
where are you by the way And shell most definitely miss her coffee if she drinks it For Melbournians coffee is everything,NB
Where are you sleeping She asks out of interest and eyeing the other woman with the blond hair She wonders if her hair is,NB
where have you been all my life There are a lot of good things about but she is without a doubt the best one,NB
where s half your face you gay cunt ahhahahahahaha,B
Where the fuck Is Oomf in her skin when she jump out are you gon jump in,NB
Whether you want to track someone down or know if he or she is committing fraud we are here for you Brian Blackwell,NB
which side are you supporting i think she auto stays if youre templar plus the wiki says her suppois more quest dependent idk,NB
Who are you to question whether she is reasonable to feel antagonized,NB
who are you Who is she,NB
Who does Doris think she is on Are you kidding me Wait who even is Doris Kobe doesnt pass the ball What an ignorant statement,NB
who is she and who the fuck are you,NB
who is she what type of best friend are you,NB
Who is she why are you tweeting her,NB
Who is this Nat D chick Why are you all listening to her She only agrees with whatever you all say sounds like a weasel trying to get in,NB
Whoa you are as pathetic as she is,B
Whoever hates on you are stupid because she is the most nicest and caring person on twitter she doesnt dese,NB
Whoever hates on you are stupid because she is the most nicest and caring person on twitter she doesnt deserve the hate,NB
Why are guys so retarded You know how your girl is and how she reacts yet you still do things that piss her off,NB
Why are people cheering Katie Hopkins for are you all tucking mental She is a proper didnt,NB
why are people still hating on Selena Literally at no point has she ever done anything to you That she hujustin shi,NB
why are people still hating on Selena Literally at no point has she ever done anything to you That she hujustin shit is beyond old,NB
Why are we arguing with my grandma about how old she will be Something s wrong with us No granny Something is wrong with you,NB
why are you dating hayato She is my best friend and we have been together for a long time It seemed right,NB
why are you drinking beer at 11 am and even worse isnt your mother pregnant what in gods name is she doing drinking beer,NB
why are you saying she is gay,NB
why are you saying us Reading in education is so fundamental What paof Shes mine dont you understand,NB
Why are you so fat Hahaha,B
why are you suck a loser,B
Why are you suddenly astonished She gently pushed away Is there something in there Im not allowed to see,NB
Why cant everyone be like She is lovely and you get people on here who are horrible Well you should act nice,NB
Why do you have this YouTube girl on She is empty headed Have on girls who have contributed to society there are plenty,NB
why haven t you talked to car where s car been are you two fighting is she ok are you guys still friends rolls eyes,NB
Why is it fostering a hostile environment Are you hostile to her because you think she used sex to get ahead,NB
Why is Katie pretending she loves the British public Unless you have a common name on benefits or are northern List goe,NB
Why is Katie pretending she loves the British public Unless you have a common name on benefits or are northern List goes on,NB
Why is she even on CNN Are you guys doing a piece about unusual torture methods ITS WORKING,NB
Why is she trying to show that Shes so hard Shawty you are no Cookie iight,NB
why is this a thing why are you a thing because she is my mom,NB
why Shes just a fat bitch that needs to die,B
Why should I have to tolerate these bastards Why can I not kill them all with fire or blunt knives and spoons,B
Why would she freak out I warn you though Brighton is trashy and there are a few druggies,NB
why you dont fuck with me noww fat pussy,B
Wink pussy,B
withloveandrea is definitely a Mom I Would Love to Flaunt she is such a fashionista If you are sexy,NB
woman when are you going to learn that as long as she is your mom you have to ask her for everything for as long as you live,NB
Women are like blunts if you lick her right she wont run this is the greatest tweet Ive ever read,NB
women need constant reassurance that she is loved You are loved,NB
wow are you calling Laura Bush a pig Is it because she killed someone,NB
Wow she is my weakness You are so beautiful thanks love,NB
Wow this is your character s daughter and you tried to rp smut when Shes feeling vulnerable Wow what a decent human being you are Kudos,NB
wow what a n00b you should fight me in the wildy and then throw your computer out the window,B
wow you shit cunts go die and get ebola FUCK FIFA your GAY LORDS your JUST FINGERING EACHOTHERS BUTS,B
Ya mamma should have swallowed yo pussy ass,B
YASSSS Miss Brucine Jenner She is fierce Why are why all mad I cant deal with you,NB
Yay Im so happy She is only 4 months old too You are like the only female YTer I watch so D,NB
yea I feel you A LOT of headcanons are kinda weird I mean I love her but I know she is guardian I just try to make,NB
yea it is Im tired too and so are you Shes just doing her job for Christ s sake,NB
yeah and if she is then why are you even with her lol,NB
yeah are you on STM someone would knock her teeth out if she came knocking on their door not nice,NB
yeah are you on STM someone would knock her teeth out if she came knocking on their door not nice is it,NB
yeah bitch i dont want your fat stomatch on my mention i am not cameron i am Agung fight her,B
yeah she is right Are you going to be in Vienna tomorrow lt 3 from Austria as well p,NB
