Comments,Classes
Yes it is I dont think I can help him She sighs sorry I shouldn t be worrying about it so how are you,NB
Yes she does You should see her pussy Immaculate,B
yes she is and are you ok now,NB
yes she is are you joining,NB
YES She is in freaking COURT why are you asking about her clothes,NB
Yes She was Just like Zedd is now in your fanbase and you all are responding to the way she is treating her,NB
yes Think try to be neutral but you know she is proud Serena Venus are from my town Live 5 miles away,NB
Yes yes I know I know But now you are back Oh David She is crying a lot still hugging him very tightly,NB
Yes you are dont say she is ugly she is not,NB
Yet my roommate is certain she isnt a hipster Even pandora knows that you are its cool I u,NB
Yo are you putting KenZ mom in the wank bank tonight if she is a milf,NB
YO PUSSY GAY,B
You all really hype up Bowser because she apparently got a fat ass meanwhile her pussy come with the stomach flu,B
you all should be afraid of what Im gone do next,B
You always know a girl is going to talk shit about someone to you when she starts out saying so how good of friends with are you,NB
You and are friendship goals as fuck Awwwww thank you a lot she is mah cutie pie i love her so freakin,NB
You and your friends are Jem girls Jem Jem is her name Shes outrageous Truly truly truly outrageous Wit,NB
You and your friends are Jem girls Jem Jem is her name Shes outrageous Truly truly truly outrageous With a hot tub car,NB
you and your girl are meant to be She knows who she is,NB
you are 19 she is 14 but you wont me tho,NB
You are a big boy Si It might be a bit difficult no matter how strong she is,NB
You are a fool I thought Angie Stone was doing good Why is she on,NB
you are a garden rose and all she is a dandelion a weed,NB
YOU ARE A GROUPIE ASS nigger LMAOOO is even tho she wont talk to me,NB
you are a horrible sexist and coward person That response shows how awesome she is but the q shows what an asshole you are,NB
you are a LIAR My mom is japanese she never heard of eating dolphin meat You should be ashamed of urself,NB
you are a liar we know you worship hillery clinton she is a socalist lying scum bag like yourself,NB
You are a moron We just think Anita is a lying con artist She also insults us So we do not like her,B
You are all blue and everything is pink I feel so happy I want whatever she is having P,NB
you are also like 16 and she is 28 or something i believe in you,NB
you are an amazing She is happy she wants a party to celebrate and you all think what Get over it its over,NB
You are back you are back She is crying a lot but also smiling widely I lost you you left me but now oh now,NB
You are beautiful she is beautiful cant that just be it,NB
You are better off hun she is just a bitter sad woman,NB
you are blind so shed DM as in so she would DM god is english your second language or,NB
You are both rockstars with at she is a rockstar,NB
you are both welcome Weird saying she since she is in the convo,NB
you are dumb ass fuck my mom worked realstate in 03 she is a nurse nowand that is not my house and you known that,NB
you are hanging out with a girl dating SO FUCKING WHAT She is gorgeous and youre happy Fuck the haters,NB
you are incorrect She is pure,NB
you are jealous from everything I do your condition is very serious you should go and see a doctor or you will die because of me,B
you are just awesome is just awesome,NB
YOU ARE ME AND I AM YOU LOOK SHE IS HIM AND HE IS HER AND SHE IS YOU AND YOU ARE HIM,NB
you are my bro but my true love is bus She get my engine revving htt,NB
You are my second favourite guest Joy Hinchcliffe is my favourite she could kill us all,NB
You are no better than she is so dont even bother,NB
You are not a directioner but you are a fan of Sophia Im not her fan because she is just a normal girl I,NB
You are not alone on that island I hate the romance will she wont she stuff too But it is CW so,NB
you are not capable of any thing Hustle your way to your grave Cunt Pathetic loser,B
you are not helping my cause do you understand what she is asking of us on her website homepage,NB
You are not here She is angry and has a Princess Dress and Crown on and she denies she even knows her dad,NB
you are one fat smelly ugly cunt,B
you are oprah she is you,NB
you are purrtyyyyy baby she is too sweet to me,NB
You are right about Nancy She is very real and vulnerable,NB
You are right Beyonce is pretty useless and isnt even hot Plus Shes from the armpit of Texas Houston,NB
You are right Matt its Rachel she is so pretty,NB
you are right She is a misfit only time will unravel it It will damage the party in long run,NB
you are right to she is alive and well in the form of Selena Gomez,NB
You are so big time is big time,NB
You are so right Made 10 out of 20 My Granddaughter can do that good and she is 7 lol,NB
You are terrified to let her go but you are afraid she is to good for you that she could drive you wild,NB
you are the best exposed now we know why she is shying from debate,NB
You are the cutest of all She is Cute,NB
You are the ice and she is sliding on it says guest maestro Edward Parmentier to our bassist,NB
YOU are the one that said she is bad at singing not me I said se sings a lot,NB
you are too but fs she is the most para person I know,NB
you are too cool for her horseshit She doesnt want help Her addiction is attention,NB
you are too wild in the tub with She is old enough to be your momma,NB
You are totally going to own that fun fact she is the only woman who hunted with the Yajuta and lived among them on their ship,NB
You are welcome and yes I do My mom is a cancer survivor It has been 22 years now We are blessed that she is still with us,NB
YOU ARE WELCOME EONNIE IS SHE AN ELF TOO LOL ANYWAYS YAYYY I HAVE A NEW EONNIE COS MOST OF THE TIME I AM THE EONNIE HAHAHA,NB
you are welcome Hope she is ok,NB
you big fat handicapped cunt,B
you boring fat cunt please hurry up and die,B
you can go suck a fat one lol,B
You can order here out Sue She is looking fabulous Sue says Are you,NB
You can tell a lot about a woman from her hands for instance if they are firmly around your throat she is probably sli,NB
You can tell a lot about a woman from her hands for instance if they are firmly around your throat she is probably slightly,NB
you cant laugh you fat cunt,B
you cant read what I tweeted I said she s a whore which means bitch know your English oh I forgot you dont understand cunt,B
You certainly are a hypocrite THAT is abundantly clear She is cute the lyrics of group are hate filled gt lt,NB
you dont look scared but you should be afraid,B
You eat more pussy den me Girl you shouldve been uh nigger,B
you fat cunt,B
You going to lick this pussy just like you should,B
you guys are weird she is joy to the world all the boys and girls ha finally placed that,NB
You have literally ruined bashurs life You should seriously fucking kill yourself you re the teal child molester,B
you have this fan who is really pressed for you You gotta step to her expectation dude She seems to think you are lacking,NB
You know a date is going poorly when she says we are just friends right,NB
You know in Grey s Anatomy were Christina and Meredith are always like Shes my person well Bryanna is my person and i love her man,NB
You know she ain t into you for shit when she is on the phone half of the time when you are talking,NB
You know she is the bestest of best friends when she offers to walk to your house and get you chocolate because you are ill,NB
You know what is fucked up is they are going to live forever but she is only going to love him for 2000 years,NB
You know what Oil prices are shot right now Plus my meat is as black as they come Let have it Shes a pro,NB
You know you are old when you want to thank for all her help She is just so smart,NB
You know your life is sad when you are elated when your mother says she will let you get a bouncy castle for your 18th,NB
You people should just die,B
You re a bitch cunt whore Bless Madonna,B
You re a loser So go ahead and live your loser life make a bunch of loser friends Then together you can lick each other s loser wounds,B
you re just the right amount of fat and i ll definitely treat you like the slut you are,B
You re right calves are amazing This is Ricki SHE is such a sweetie loves to be petted,NB
you re such a stupid cunt Die You re better dead than alive You should be in an elderly home Being abused,B
you right now you fat ugly cunt,B
you say me first that i am pretty and i believe naow you say that the bich is pretty and you are boy-friend of she,NB
You see there with Brandi bringing up the fact all these girls are actresses its like she wants to be one Or is obsessed with TV,NB
you should all die,B
You should be able to fight soon right,B
You should be in bed you slut,B
You Should Die,B
You should die all together,B
you should die for that,B
you should die now Haru,B
you should get me one because I cant ever meet them but what the hell is her problem She was a JCAT and then left cause uj are,NB
you should kill yourself dad,B
YOU SHOULD PROBABLY KILL YOURSELF,B
You should really consider working on your people skills Im fine with people you re just a cunt,B
You should Suck My Dick How about that one,B
You should thank me for the honour of letting you watch me fill your hot wife tight cunt snow bunny bbc owned,B
you should totally tweet her she is literally LOVES you We are also planning to kidnap you and Riker,NB
you should ve beat him lmao I told you too,B
You shouldn t be pissed at me for my 3 inch dick you should be pissed at the big ass pussy you got,B
you shouldn t say that She is trying to sparkle and you are bringing down her shimmer,NB
you suck,B
you suck fat chicken cock,B
you suck fat dick that s why,B
you sure you are okay Im fine My sprain is nearly gone She is very good thanks sweetie,NB
You too are a special person to me I hope someday to meet her she to meet my friends is very sweet,NB
you wanted him out last week you fickle cunt make that mind up you fat cunt,B
You were getting fingered and eaten out at 12 lmfao by a 17 year old Ahaha you should be ashamed of yourself nasty little slut lmao,B
you would swear she went on a week bender Is this not meant to be realistic people are going t,NB
you would swear she went on a week bender Is this not meant to be realistic people are going to drink,NB
Young Pretty Indian Whore Loves To Suck And Fuck,B
your a gay cunt Mikee,B
Your daughter is not a special snowflake she is a lazy little madam and you are enabling her Stop it right now,NB
your daughter should go choke on a dick and die,B
Your girlfriend is going to cum when she sees you thats my cousin why all,NB
Your little girl is going to be wise with a mom like you Shes going to be so proud when she realises how strong you are,NB
your welcome You are studying with garland she told me that she is studying french too,NB
Your wife is half your Deen half of you half of your Islam You are not complete without her So treat her as the Quee,NB
Youre so afraid of being called gay Got a secret kid,B
Zach or whatever their names are No she was just out of focus And why do you think that is idiot,NB
What a cute smile you have; it gives me happiness.,NB
You look cute like a night queen.,NB
The control of excellence lies inside the soul.,NB
I wonder how cute you would be looking when you sleep.,NB
You are Just an icon of beauty.,NB
Each of these pictures is making my day in a lovely way.,NB
OK I?m sorry but I?m pretty sure it?s illegal to look this good.,NB
That confusing moment in which you do not know what to comment on because you know what you write would not be enough.,NB
Can?t thank your Mom and Dad enough for making someone as beautiful as you.,NB
OMG!!! You are such a raving angel.,NB
"Each flower withers, but you won?t.",NB
"I tried many combinations of words to praise you well, every time I ended up dissatisfied.",NB
Are you as beautiful on the inside as you are on the outside?.,NB
I would say god bless you but it looks like he already did.,NB
 Hotshot n honey trapped inside you and the Meaning of Sweetness lies in you.,NB
 Take it from me when I say that you are the most beautiful woman on planet earth.,NB
Aren?t you the tiger on the Frosted Flakes box? Because you look ?Grrrreat!?.,NB
 My heart skips a beat each time I think of you. Or perhaps it?s more of a somersault.,NB
Wow!!! Look at your queenly gown with your royal smile.,NB
"Beauty captures your attention, but personality captures your heart.",NB
"Sometimes I need expert advice? So, I talk to myself.",NB
To succeed in life? You need two things? Ignorance and Confidence?,NB
"If someone tells you that you are ugly. well, just be nice and say. Excuse me. I?M NOT YOUR MIRROR.",NB
"There are two ways to be happy: Change your situation, or change your mindset towards it.",NB
"Love is the other name of respect, if you can?t respect your loved one, then you don?t deserve to be loved",NB
It?s nice when someone cares about you as much as you care about them.,NB
My real smile comes out when I am with you ?.,NB
"I can see the future, let me give you a clue, it?s ME + U.",NB
Love is that holy medicine that can cure all your wounds.,NB
"Because of you, I laugh a little louder, cry a lot less, and smile a lot more.",NB
If you smile every time his name pops up on your screen. You?re in love.,NB
I am trying not to think about you but it?s not working.,NB
The beauty of true love is it accepts your flaws and withholds them beautifully.,NB
"Every GIRL deserves a boy who can change her LIFE, not only her relationship status.",NB
Just seeing your smile makes me feel better inside.,NB
"Love is sweet when it?s new, but sweeter when it?s true.",NB
Sometimes words are not enough.,NB
Life is not about who hurt you and broke you down. It?s about who was always there and who made you smile again.,NB
Success always follows hard work.,NB
Take every chance you get in life because some things only happen once.,NB
"Don?t sit like a rock, work like a clock.",NB
"Good people are like candles, they burn themselves up to give others light.",NB
If you obey all the rules. You miss all the fun.,NB
"Coming together is beginning, Keeping together is progress, Working together is a success.",NB
"The older I get, the less I care about how many friends I have. Quality over Quantity.",NB
Half of seeming clever is keeping your mouth shut at right times.,NB
Elegance doesn?t consist of putting on a new dress.,NB
"Don?t be like the rest of them, darling.",NB
"Life is too short to be serious, so laugh.",NB
If you can?t explain Simply then you don?t understand it well enough.,NB
If plan A didn?t work. The alphabet has more letters! Stay Cool.,NB
Sometimes the most clever thing to say is nothing at all.,NB
"Sell a man a fish, he will eat for a day, teach a man to fish, you?ll be out of a job?",NB
Where you start is not as important as where you finish.,NB
They say never judge a book by its cover but they also said a picture is worth a thousand words.,NB
A clever person solves a problem. A wise person avoids it,NB
"Yesterday I was clever, so I wanted to change the world. Today I am wise, so I am changing myself",NB
Nothing is particularly hard if you divide it into small jobs.,NB
"Never point your finger at someone, you will always have three fingers pointing back at you.",NB
Better to ask forgiveness than permission.,NB
You can tell whether a man is clever by his answers. You can tell whether a man is wise by his questions.,NB
A clever man is one who never shows his cleverness to others.,NB
He who waits to take the first step will spend his entire life on one foot.,NB
"Build a man a fire, he?s warm for a day. Light a man on fire and he?s warm for the rest of his life.",NB
"After one realizes he?s been a fool, he?s not a fool anymore.",NB
Half of seeming clever is keeping your mouth shut at the right times.,NB
"Patience is not the ability to wait, but the ability to keep a good attitude while waiting.",NB
A person who asks a question is a fool for 5 minutes..but a person who doesn?t is a fool forever.,NB
"When life gives you lemons, make orange juice, and have the world wondering how the hell you did it.",NB
What worked yesterday doesn't always work today.,B
It has been my observation that most people get ahead during the time that others waste,B
"When you expect the world to end at any moment, you know there is no need to hurry. You take your time, you do your work well.",B
It is quality rather than quantity that matters.,B
The greatest weariness comes from work not done.,B
"I've always said that idleness dulls the spirit. We have to keep the brain busy, or at least the hands if we don't have a brain.",B
"Thinking is the hardest work anyone can do, which is probably the reason why we have so few thinkers.",B
We spent our lives making livings.,B
Bureaucracy is the death of all sound work.,B
I want to be thoroughly used up when I die for the harder I work the more I live. I rejoice in life for its own sake.,B
The more I want to get something done the less I call it work.,B
I had the most boring office job in the world...I used to clean the windows on envelopes.,B
Ninety percent of paid work is time-wasting crap. The world gets by on the other ten.,B
Work will drive you crazy if you let it.,B
"Why do I have to do the sewing? Because I'm a girl? Is that it? It isn't fair, I tell you!",B
All work is the avoidance of harder work.,B
"Work hard, put maximum effort, and have a good attitude. Most importantly never give up.",B
The human worker will go the way of the horse.,B
No work is so important you have to do it.,B
What are you NOT working on that you should?,B
"If your work is stressful, it's not your work.",B
And love is work. But it's the best kind of work there is.,B
There's an art in every labour.,B
I see your point. It irks you to see anyone at all who is able to work permitted to live without working. But why do you consider work a virtue?,B
"I have no idea how to be an artist and a lover, so I chose the one most likely to make me happy when I'm eighty and gazing back on a long and productive life.",B
Writing is a worthwhile work.,B
It is a must to excel in our work.,B
Do it with passion or not at all.,B
Can't say a body ever gets used to hard work,B
Yes. Work is love made visible.,B
"My soul, sir? I haven't got one. The management doesn't allow them.",B
"If you're going to be working, you might as well work with passion and give it all you've got.",B
Let others slap each others on the back while you're back in the lab or the gym or pounding the pavement.,B
"When you select a career, it not only affects you but many people who depend on your work.",B
"Our culture needs to find a robust image of female success that is first, not male, and second, not a white woman on the phone, holding a crying baby,",B
"My mother often said, as long as a person is happy at work, then poverty is nothing to be ashamed of.",B
I have learned to have pride in what I do.,B
"If you enjoy being at work more than being at home it doesn't mean you are a workaholic, it simply means you are in love with your work and you worship it.",B
Even the ordinary business of cleaning house seemed somehow to have become sacramental.,B
"Work is a process, and any process needs to be controlled. To make work productive, therefore, requires building the appropriate controls into the process of work.",NB
We work to firstly realize our hidden potentials.,B
"All jobs are odd, or they would be games or naps or picnics.",B
Don't be concerned with what you can't do. Work on what you can do - then count your blessings.,B
Work therefore is the paramount key to discovering yourself.,B
Without labor nothing prospers.,B
Hard work is often the easy work you did not do at the proper time.,B
I love to keep it by me: the idea of getting rid of it nearly breaks my heart.,B
Managing is getting paid for home runs someone else hits.,B
Most of the men sitting in first class on an airplane have really boring jobs.,B
Professional life is like a fire hydrant. You spend all of your time putting out fires and standing your ground against the big dogs.,B
People who work sitting down get paid more than people who work standing up.,B
I left journalism because I met too many interesting people at an uninteresting salary.,B
"This bitch has no right to talk about fair and has no right to celebrate, I hope that they crash and burn they don't deserve to be here",B
she should be practising on her cooking skills,B
Why does she have to be such a cunt?,B
Seriously. Crazy eyes is staying?,B
"She is actually a bitch, but I had to laugh at her response.",B
Helena is such an awful bitch!,B
You do not become smarter by blowing your own horn. You become smarter by being humble.,NB
"The early bird may get the worm, but the second mouse gets the cheese.",NB
"Life has its ups and downs, use the ups to overcome the downs!",NB
"Intelligence is more important than strength, that is why the earth is ruled by men and not by animals.",NB
"To live is the rarest thing in the world. Most people exist, that is all.",NB
"Life can only be understood backward, but it must be lived forward.",NB
"When life gives you lemons, squirt someone in the eye!!!!!",NB
"Life is really simple, but we insist on making it complicated.",NB
"An eye for an eye will ultimately, leave the whole world blind.",NB
There are more stars in the sky then there are grains of sand on Earth.,NB
"It is not the strongest of the species that survive, nor the most intelligent, but the one most responsive to change",NB
"ove is giving somebody the power to destroy you, but trusting them not to.",NB
"Love is like a rose in the winter, only the strong survive.",NB
How can people say I love you so easily?,NB
Don?t they know that every time they do they give a piece of your heart to someone?when you finally do REALLY LOVE someone will there be enough of your heart to give???,NB
"Life is like a ten-speed bike, most of us have gears we never use",NB
A true friend is someone who is there for you when he?d rather be anywhere else.,NB
?A true friend overlooks your failures and tolerates your success!?,NB
It is far better to be alone than to be in bad company.,NB
It takes a long time to grow an old friend.,NB
The best way to destroy an enemy is to make him a friend.,NB
The only way to have a friend is to be one.,NB
Every girl needs a good guy who can help her laugh when she thinks she will never smile again,NB
My real smile comes out when I am with you ?,NB
"You never love someone because they?re beautiful, they are beautiful because you love them.",NB
Love is like the sun coming out from the clouds and warming your soul.,NB
"When someone else happiness is your happiness, it?s called true love.",NB
You are one of those beautiful things that happened to my life and made my life worthwhile,NB
"In the middle of life, love enters and makes it a fairy tale.",NB
 The person who loves you truly is the most precious thing in your life?,NB
Be aware to touch me? you may be a victim of Love.,NB
I never could have accomplished what I have today without the love I feel from you!,NB
Suddenly all the love songs are about you.,NB
"You?re the only man I dream about at night, and the only man I want to wake up next to in the morning.",NB
Every time you text me my cheeks hurt! I guess I smile too big.,NB
I?ve fallen in love many times but always with you.,NB
"When I dream, I dream of you. Maybe one day, dreams will come true. Because I really love you.",NB
My love for you is a journey that starts at forever and ends at never in Life?,NB
Getting over him sounds great but being in his arms sounds a lot better,NB
"I am lucky to have you in my life? Thank god that I have a beautiful girl who gives her best in loving me. Love, you are my lifeline.",NB
"No matter where you go or what you do, my love will follow you to the ends of the earth.",NB
"Real happiness is when you marry a girl for love and find out later, she has lots of money.",NB
Falling in love with you is the second-best thing in the world. Finding you is the first.,NB
 I never could have accomplished what I have today without the love I feel from you!,NB
"Since you?ve been around, I smile a lot more than I used to.",NB
"Let me love you if not for the rest of your life, then for the rest of mine.",NB
 I?m selfish because I will never share you with anyone else.,NB
 I know I am in love with you because my reality is finally better than my dreams.,NB
Being deeply loved by someone gives you strength. While loving someone deeply gives you courage.,NB
I wish I could turn back the clock. I?d find you sooner and love you longer.,NB
You are my first thought when I wake up and the last thought when I go to sleep. I cannot describe how much I?m in love with you. It is simply indescribable.,NB
Your cute smile is all I need to battle all struggles in my life.,NB
The happiest I?ve ever felt was that moment I discovered you loved me too.,NB
"A true man does not need to love a different girl each and every night, a true man loves the same girl for the rest of her life.",NB
Don?t look for love. Quietly give it away and let it find you back.,NB
If I had to choose between loving you and breathing. I would use my last breath to say I love you.,NB
I?m not drunk; I?m in love.,NB
"I fell in love with you, I don?t know why or how. I just did.",NB
A man in love is incomplete until he is married to her love. Then he?s finished.,NB
Your smile is the key to my heart.,NB
It?s hard to find the words to express how I feel about you. I have tried and always come back to just one word: love.,NB
